{
  "schema_version": 1,
  "slug": "valid-parentheses",
  "metadata": {
    "leetcode_id": 20,
    "title_en": "Valid Parentheses",
    "title_zh": "有效的括號",
    "leetcode_url": "https://leetcode.com/problems/valid-parentheses/",
    "pattern": ["stack", "string"],
    "difficulty": "easy",
    "generated_at": "2026-04-26",
    "generated_by": "manual"
  },
  "explanation_html": "<div class=\"lc-section\"><h3 style=\"margin:0 0 12px 0;color:var(--lc-primary);\">🎯 題目重新框架</h3><p style=\"line-height:1.6;\">給你一個只包含 <code>'('</code>, <code>')'</code>, <code>'{'</code>, <code>'}'</code>, <code>'['</code>, <code>']'</code> 的字串,判斷它是否是<strong>有效</strong>的括號序列。</p><p style=\"line-height:1.6;\">有效的條件:</p><ul style=\"line-height:1.7;\"><li>每個左括號必須有<strong>對應</strong>的右括號</li><li>左右括號必須<strong>正確配對</strong>(<code>(]</code> 不算)</li><li>左括號必須以<strong>正確的順序</strong>關閉(<code>([)]</code> 不算,因為內外順序錯誤)</li></ul><svg viewBox=\"0 0 600 200\" xmlns=\"http://www.w3.org/2000/svg\" style=\"width:100%;height:auto;display:block;margin:12px 0;\"><text x=\"10\" y=\"30\" fill=\"var(--lc-success)\" font-size=\"16\" font-weight=\"700\">✓ 有效</text><text x=\"80\" y=\"30\" fill=\"var(--lc-text)\" font-size=\"18\" font-family=\"monospace\">\"()[]{}\"</text><text x=\"80\" y=\"55\" fill=\"var(--lc-text)\" font-size=\"18\" font-family=\"monospace\">\"({[]})\"</text><text x=\"310\" y=\"55\" fill=\"var(--lc-muted)\" font-size=\"13\">外層完整包住內層</text><text x=\"10\" y=\"110\" fill=\"var(--lc-danger)\" font-size=\"16\" font-weight=\"700\">✗ 無效</text><text x=\"80\" y=\"110\" fill=\"var(--lc-text)\" font-size=\"18\" font-family=\"monospace\">\"(]\"</text><text x=\"310\" y=\"110\" fill=\"var(--lc-muted)\" font-size=\"13\">類型不匹配</text><text x=\"80\" y=\"140\" fill=\"var(--lc-text)\" font-size=\"18\" font-family=\"monospace\">\"([)]\"</text><text x=\"310\" y=\"140\" fill=\"var(--lc-muted)\" font-size=\"13\">交叉,順序錯誤</text><text x=\"80\" y=\"170\" fill=\"var(--lc-text)\" font-size=\"18\" font-family=\"monospace\">\"(((\"</text><text x=\"310\" y=\"170\" fill=\"var(--lc-muted)\" font-size=\"13\">沒有關閉</text></svg><h4 style=\"margin:16px 0 8px 0;color:var(--lc-warning);\">⚠️ 邊界情況</h4><ul style=\"line-height:1.7;padding-left:20px;\"><li>空字串 <code>\"\"</code> 視為<strong>有效</strong></li><li>只有右括號 <code>\")\"</code> → 無效</li><li>只有左括號 <code>\"(\"</code> → 無效</li><li>奇數長度的字串<strong>不可能</strong>有效</li></ul></div>",
  "hints_html": [
    "<div class=\"lc-section\"><h4 style=\"margin:0 0 8px 0;color:var(--lc-primary);\">💡 提示 1 — 重新框架</h4><p style=\"line-height:1.6;\">當你看到一個<strong>右括號</strong>,你需要立刻知道:它應該配對<strong>哪一個</strong>左括號?</p><p style=\"line-height:1.6;\">想想看,如果字串是 <code>\"({[]})\"</code>,當你掃到第一個 <code>]</code> 時,你期待的是<strong>最近一個還沒配對的</strong>左括號是 <code>[</code>。</p><div style=\"background:rgba(91,141,239,0.08);padding:12px;border-radius:8px;margin:8px 0;\">⚡ 「最近的、還沒處理的」是什麼結構的特性?LIFO(後進先出)。</div></div>",
    "<div class=\"lc-section\"><h4 style=\"margin:0 0 8px 0;color:var(--lc-primary);\">💡 提示 2 — 關鍵資料結構</h4><p style=\"line-height:1.6;\">使用 <strong>Stack(堆疊)</strong>。</p><ul style=\"line-height:1.7;\"><li>遇到<strong>左括號</strong> → push 進 stack</li><li>遇到<strong>右括號</strong> → pop 出 stack 頂端,檢查是否配對</li></ul><svg viewBox=\"0 0 600 200\" xmlns=\"http://www.w3.org/2000/svg\" style=\"width:100%;height:auto;display:block;margin:8px 0;\"><text x=\"10\" y=\"20\" fill=\"var(--lc-text)\" font-size=\"14\" font-weight=\"700\">處理 \"({[]})\":</text><g><rect x=\"20\" y=\"40\" width=\"60\" height=\"40\" rx=\"4\" fill=\"rgba(91,141,239,0.2)\" stroke=\"var(--lc-primary)\"/><text x=\"50\" y=\"65\" text-anchor=\"middle\" fill=\"var(--lc-text)\" font-size=\"18\" font-family=\"monospace\">(</text><text x=\"50\" y=\"100\" text-anchor=\"middle\" fill=\"var(--lc-muted)\" font-size=\"11\">push</text></g><g><rect x=\"100\" y=\"40\" width=\"60\" height=\"40\" rx=\"4\" fill=\"rgba(91,141,239,0.2)\" stroke=\"var(--lc-primary)\"/><text x=\"130\" y=\"65\" text-anchor=\"middle\" fill=\"var(--lc-text)\" font-size=\"18\" font-family=\"monospace\">{</text><text x=\"130\" y=\"100\" text-anchor=\"middle\" fill=\"var(--lc-muted)\" font-size=\"11\">push</text></g><g><rect x=\"180\" y=\"40\" width=\"60\" height=\"40\" rx=\"4\" fill=\"rgba(91,141,239,0.2)\" stroke=\"var(--lc-primary)\"/><text x=\"210\" y=\"65\" text-anchor=\"middle\" fill=\"var(--lc-text)\" font-size=\"18\" font-family=\"monospace\">[</text><text x=\"210\" y=\"100\" text-anchor=\"middle\" fill=\"var(--lc-muted)\" font-size=\"11\">push</text></g><g><rect x=\"260\" y=\"40\" width=\"60\" height=\"40\" rx=\"4\" fill=\"rgba(63,185,80,0.2)\" stroke=\"var(--lc-success)\"/><text x=\"290\" y=\"65\" text-anchor=\"middle\" fill=\"var(--lc-text)\" font-size=\"18\" font-family=\"monospace\">]</text><text x=\"290\" y=\"100\" text-anchor=\"middle\" fill=\"var(--lc-success)\" font-size=\"11\">pop [ ✓</text></g><g><rect x=\"340\" y=\"40\" width=\"60\" height=\"40\" rx=\"4\" fill=\"rgba(63,185,80,0.2)\" stroke=\"var(--lc-success)\"/><text x=\"370\" y=\"65\" text-anchor=\"middle\" fill=\"var(--lc-text)\" font-size=\"18\" font-family=\"monospace\">}</text><text x=\"370\" y=\"100\" text-anchor=\"middle\" fill=\"var(--lc-success)\" font-size=\"11\">pop { ✓</text></g><g><rect x=\"420\" y=\"40\" width=\"60\" height=\"40\" rx=\"4\" fill=\"rgba(63,185,80,0.2)\" stroke=\"var(--lc-success)\"/><text x=\"450\" y=\"65\" text-anchor=\"middle\" fill=\"var(--lc-text)\" font-size=\"18\" font-family=\"monospace\">)</text><text x=\"450\" y=\"100\" text-anchor=\"middle\" fill=\"var(--lc-success)\" font-size=\"11\">pop ( ✓</text></g><text x=\"10\" y=\"140\" fill=\"var(--lc-success)\" font-size=\"14\" font-weight=\"700\">最後 stack 為空 → 有效</text><text x=\"10\" y=\"165\" fill=\"var(--lc-muted)\" font-size=\"12\">(若 stack 非空 → 有左括號沒關閉 → 無效)</text></svg></div>",
    "<div class=\"lc-section\"><h4 style=\"margin:0 0 8px 0;color:var(--lc-primary);\">💡 提示 3 — 虛擬碼骨架</h4><pre style=\"background:rgba(0,0,0,0.05);padding:12px;border-radius:8px;overflow-x:auto;line-height:1.5;\"><code>def is_valid(s):\n    pairs = {')': '(', ']': '[', '}': '{'}    # 右 → 左 對照表\n    stack = []\n\n    for ch in s:\n        if ch in '([{':\n            ____                              # 左括號:push\n        else:\n            if not stack or ____ != ____:    # 沒得 pop 或不配對\n                return False\n            ____                              # 配對成功:pop\n\n    return ____                               # stack 應該為空才有效\n</code></pre><div style=\"background:rgba(63,185,80,0.1);padding:12px;border-radius:8px;border-left:3px solid var(--lc-success);margin:12px 0;\"><strong>🎯 兩個關鍵檢查:</strong><br>1. 遇到右括號時,stack <strong>不能是空的</strong>(否則沒得配對)<br>2. 結束時,stack 必須<strong>是空的</strong>(否則有左括號沒關閉)</div></div>"
  ],
  "solution_html": "<div class=\"lc-section\"><h3 style=\"margin:0 0 12px 0;color:var(--lc-success);\">✅ 完整解法</h3><pre style=\"background:rgba(0,0,0,0.05);padding:12px;border-radius:8px;overflow-x:auto;line-height:1.5;\"><code class=\"language-python\">def is_valid(s: str) -> bool:\n    # 右括號 → 對應的左括號\n    pairs = {')': '(', ']': '[', '}': '{'}\n    stack = []\n\n    for ch in s:\n        if ch in '([{':\n            # 左括號:push 進 stack\n            stack.append(ch)\n        else:\n            # 右括號:檢查 stack 頂端是不是對應的左括號\n            if not stack or stack[-1] != pairs[ch]:\n                return False\n            stack.pop()\n\n    # 全部處理完,stack 必須是空的\n    return len(stack) == 0\n</code></pre><h4 style=\"margin:16px 0 8px 0;color:var(--lc-primary);\">📖 程式碼走查</h4><p style=\"line-height:1.6;\">以 <code>s = \"()[]{}\"</code> 為例:</p><ol style=\"line-height:1.8;padding-left:20px;\"><li><code>'('</code> → push,stack = <code>['(']</code></li><li><code>')'</code> → 頂端是 <code>'('</code>,匹配 → pop,stack = <code>[]</code></li><li><code>'['</code> → push,stack = <code>['[']</code></li><li><code>']'</code> → 頂端是 <code>'['</code>,匹配 → pop,stack = <code>[]</code></li><li><code>'{'</code> → push,stack = <code>['{']</code></li><li><code>'}'</code> → 頂端是 <code>'{'</code>,匹配 → pop,stack = <code>[]</code></li><li>結束,stack 為空 → <strong>有效</strong> ✓</li></ol><p style=\"line-height:1.6;\">反例 <code>s = \"([)]\"</code>:</p><ol style=\"line-height:1.8;padding-left:20px;\"><li><code>'('</code> → push,stack = <code>['(']</code></li><li><code>'['</code> → push,stack = <code>['(', '[']</code></li><li><code>')'</code> → 頂端是 <code>'['</code>,但 <code>pairs[')'] = '('</code> ≠ <code>'['</code> → <strong>失敗,return False</strong> ✗</li></ol><h4 style=\"margin:16px 0 8px 0;color:var(--lc-primary);\">⏱️ 複雜度分析</h4><table style=\"width:100%;border-collapse:collapse;margin:8px 0;\"><tr style=\"background:rgba(91,141,239,0.1);\"><th style=\"padding:8px;border:1px solid var(--lc-border);text-align:left;\">指標</th><th style=\"padding:8px;border:1px solid var(--lc-border);text-align:left;\">複雜度</th><th style=\"padding:8px;border:1px solid var(--lc-border);text-align:left;\">原因</th></tr><tr><td style=\"padding:8px;border:1px solid var(--lc-border);\"><strong>時間</strong></td><td style=\"padding:8px;border:1px solid var(--lc-border);\"><code>O(n)</code></td><td style=\"padding:8px;border:1px solid var(--lc-border);\">每個字元處理一次,push/pop 都是 O(1)</td></tr><tr><td style=\"padding:8px;border:1px solid var(--lc-border);\"><strong>空間</strong></td><td style=\"padding:8px;border:1px solid var(--lc-border);\"><code>O(n)</code></td><td style=\"padding:8px;border:1px solid var(--lc-border);\">最壞情況全部都是左括號</td></tr></table><div style=\"background:rgba(255,200,0,0.12);padding:14px;border-radius:8px;border-left:4px solid var(--lc-warning);margin:16px 0;\"><strong>💡 Key Insight</strong><br><span style=\"line-height:1.6;\">嵌套配對問題 → Stack。當一個元素的處理依賴「最近一個還沒被處理的元素」時,stack 是首選。</span></div></div>",
  "related_slugs": ["generate-parentheses", "longest-valid-parentheses", "min-stack"]
}
