{
  "schema_version": 1,
  "slug": "maximum-total-subarray-value-i",
  "metadata": {
    "leetcode_id": 3689,
    "title_en": "Maximum Total Subarray Value I",
    "title_zh": "子陣列最大總價值 I",
    "leetcode_url": "https://leetcode.com/problems/maximum-total-subarray-value-i/",
    "pattern": ["array", "greedy"],
    "difficulty": "medium",
    "generated_at": "2026-06-09",
    "generated_by": "claude"
  },
  "explanation_html": "<div class=\"lc-section\"><h3 style=\"margin:0 0 12px 0;color:var(--lc-primary);\">🎯 題目重新框架</h3><p style=\"line-height:1.6;\">給你一個長度為 <code>n</code> 的整數陣列 <code>nums</code> 以及正整數 <code>k</code>。你需要選擇<strong>恰好 k 個</strong>非空子陣列（允許重疊、允許重複選同一段）。</p><p style=\"line-height:1.6;\">每個子陣列 <code>nums[l..r]</code> 的「<strong>價值</strong>」定義為：<code>max(nums[l..r]) - min(nums[l..r])</code>，即該段的最大值與最小值之差（範圍寬度）。</p><p style=\"line-height:1.6;\">目標是讓所有 k 個子陣列的<strong>價值總和</strong>盡可能大。</p><div style=\"background:rgba(91,141,239,0.08);padding:12px;border-radius:8px;margin:12px 0;border-left:3px solid var(--lc-primary);\"><strong>📌 範例：</strong><br><code>nums = [4, 2, 5, 1], k = 3</code> → 答案是 <code>12</code></div><svg viewBox=\"0 0 600 200\" xmlns=\"http://www.w3.org/2000/svg\" style=\"width:100%;height:auto;display:block;margin:8px 0;\"><rect x=\"50\" y=\"70\" width=\"70\" height=\"55\" rx=\"8\" fill=\"rgba(91,141,239,0.15)\" stroke=\"var(--lc-border)\" stroke-width=\"2\"/><text x=\"85\" y=\"103\" text-anchor=\"middle\" fill=\"var(--lc-text)\" font-size=\"22\" font-weight=\"700\">4</text><text x=\"85\" y=\"145\" text-anchor=\"middle\" fill=\"var(--lc-muted)\" font-size=\"12\">[0]</text><rect x=\"140\" y=\"70\" width=\"70\" height=\"55\" rx=\"8\" fill=\"rgba(91,141,239,0.15)\" stroke=\"var(--lc-border)\" stroke-width=\"2\"/><text x=\"175\" y=\"103\" text-anchor=\"middle\" fill=\"var(--lc-text)\" font-size=\"22\" font-weight=\"700\">2</text><text x=\"175\" y=\"145\" text-anchor=\"middle\" fill=\"var(--lc-muted)\" font-size=\"12\">[1]</text><rect x=\"230\" y=\"70\" width=\"70\" height=\"55\" rx=\"8\" fill=\"rgba(63,185,80,0.25)\" stroke=\"var(--lc-success)\" stroke-width=\"3\"/><text x=\"265\" y=\"103\" text-anchor=\"middle\" fill=\"var(--lc-success)\" font-size=\"22\" font-weight=\"700\">5</text><text x=\"265\" y=\"145\" text-anchor=\"middle\" fill=\"var(--lc-muted)\" font-size=\"12\">[2]</text><text x=\"265\" y=\"62\" text-anchor=\"middle\" fill=\"var(--lc-success)\" font-size=\"12\" font-weight=\"600\">max</text><rect x=\"320\" y=\"70\" width=\"70\" height=\"55\" rx=\"8\" fill=\"rgba(255,100,100,0.2)\" stroke=\"var(--lc-danger)\" stroke-width=\"3\"/><text x=\"355\" y=\"103\" text-anchor=\"middle\" fill=\"var(--lc-danger)\" font-size=\"22\" font-weight=\"700\">1</text><text x=\"355\" y=\"145\" text-anchor=\"middle\" fill=\"var(--lc-muted)\" font-size=\"12\">[3]</text><text x=\"355\" y=\"62\" text-anchor=\"middle\" fill=\"var(--lc-danger)\" font-size=\"12\" font-weight=\"600\">min</text><line x1=\"265\" y1=\"165\" x2=\"355\" y2=\"165\" stroke=\"var(--lc-warning)\" stroke-width=\"2\"/><polygon points=\"265,160 265,170 258,165\" fill=\"var(--lc-warning)\"/><polygon points=\"355,160 355,170 362,165\" fill=\"var(--lc-warning)\"/><text x=\"310\" y=\"183\" text-anchor=\"middle\" fill=\"var(--lc-warning)\" font-size=\"12\">5 - 1 = 4</text><text x=\"490\" y=\"88\" text-anchor=\"middle\" fill=\"var(--lc-text)\" font-size=\"14\">k = 3 次</text><text x=\"490\" y=\"115\" text-anchor=\"middle\" fill=\"var(--lc-success)\" font-size=\"22\" font-weight=\"700\">4 × 3 = 12</text><text x=\"490\" y=\"140\" text-anchor=\"middle\" fill=\"var(--lc-muted)\" font-size=\"13\">總價值</text></svg><h4 style=\"margin:16px 0 8px 0;color:var(--lc-warning);\">⚠️ 邊界情況</h4><ul style=\"line-height:1.7;padding-left:20px;\"><li>陣列所有元素相同（如 <code>[5, 5, 5]</code>）：任何子陣列的 max - min = 0，答案為 0</li><li>k = 1：退化成單純找最大子陣列價值</li><li>n = 1（只有一個元素）：任何子陣列只含一個元素，value = 0，答案為 0</li><li>數值可達 10⁹，k 可達 10⁵；結果最大約 10¹⁴，Python 自動處理大整數</li></ul></div>",
  "hints_html": [
    "<div class=\"lc-section\"><h4 style=\"margin:0 0 8px 0;color:var(--lc-primary);\">💡 提示 1 — 重新框架問題</h4><p style=\"line-height:1.6;\">k 個子陣列的選擇是<strong>完全獨立</strong>的（允許重複選同一段），所以「最大化總和」等價於「讓每一個子陣列都盡量大」。</p><p style=\"line-height:1.6;\">換句話說：如果你能找到一個<strong>最大價值的子陣列</strong>，把它選 k 次就是最優策略。</p><div style=\"background:rgba(91,141,239,0.08);padding:12px;border-radius:8px;margin:8px 0;\">⚡ 問題轉化為：如何找到<strong>單個最大價值</strong>的子陣列？</div></div>",
    "<div class=\"lc-section\"><h4 style=\"margin:0 0 8px 0;color:var(--lc-primary);\">💡 提示 2 — 關鍵觀察</h4><p style=\"line-height:1.6;\">想想「延長子陣列一格」會發生什麼：</p><ul style=\"line-height:1.7;padding-left:20px;\"><li>最大值只會<strong>增大或持平</strong></li><li>最小值只會<strong>減小或持平</strong></li><li>因此 max - min（價值）<strong>只會增大或持平</strong></li></ul><p style=\"line-height:1.6;\">這個單調性告訴你：把子陣列延伸到包含整個陣列的某兩個特殊元素，就能得到最大的單段價值。這兩個特殊元素是什麼？</p></div>",
    "<div class=\"lc-section\"><h4 style=\"margin:0 0 8px 0;color:var(--lc-primary);\">💡 提示 3 — 虛擬碼骨架</h4><pre style=\"background:rgba(0,0,0,0.05);padding:12px;border-radius:8px;overflow-x:auto;line-height:1.5;\"><code>def maxSubarrayValue(nums, k):\n    # 延長子陣列不會讓 value 變小\n    # 最大 value 由整個陣列的 ____ 和 ____ 決定\n    best = ____(nums) - ____(nums)\n    return best * ____\n</code></pre><div style=\"background:rgba(63,185,80,0.1);padding:12px;border-radius:8px;border-left:3px solid var(--lc-success);margin:12px 0;\"><strong>🔑 提示：</strong>best 的計算只需要兩個 Python 內建函數，總共一行就夠了。</div></div>"
  ],
  "solution_html": "<div class=\"lc-section\"><h3 style=\"margin:0 0 12px 0;color:var(--lc-success);\">✅ 完整解法</h3><pre style=\"background:rgba(0,0,0,0.05);padding:12px;border-radius:8px;overflow-x:auto;line-height:1.5;\"><code class=\"language-python\">def maxSubarrayValue(nums: list, k: int) -> int:\n    # 任意延長子陣列只會讓 max 增大、min 減小\n    # 因此包含全域 max 和 min 的子陣列擁有最大的 value\n    best = max(nums) - min(nums)\n\n    # 貪心：把最大 value 的子陣列選 k 次即可\n    return best * k\n</code></pre><h4 style=\"margin:16px 0 8px 0;color:var(--lc-primary);\">📖 程式碼走查</h4><svg viewBox=\"0 0 600 200\" xmlns=\"http://www.w3.org/2000/svg\" style=\"width:100%;height:auto;display:block;margin:8px 0;\"><text x=\"10\" y=\"20\" fill=\"var(--lc-text)\" font-size=\"13\" font-weight=\"700\">範例 1：nums = [1, 3, 2], k = 2</text><rect x=\"10\" y=\"30\" width=\"560\" height=\"60\" rx=\"6\" fill=\"rgba(91,141,239,0.07)\" stroke=\"var(--lc-border)\" stroke-width=\"1\"/><text x=\"20\" y=\"52\" fill=\"var(--lc-text)\" font-size=\"13\">max(nums) = 3，min(nums) = 1</text><text x=\"20\" y=\"72\" fill=\"var(--lc-text)\" font-size=\"13\">best = 3 - 1 = 2 → 回傳 2 × 2 = </text><text x=\"280\" y=\"72\" fill=\"var(--lc-success)\" font-size=\"13\" font-weight=\"700\">4 ✓</text><text x=\"10\" y=\"115\" fill=\"var(--lc-text)\" font-size=\"13\" font-weight=\"700\">範例 2：nums = [4, 2, 5, 1], k = 3</text><rect x=\"10\" y=\"125\" width=\"560\" height=\"60\" rx=\"6\" fill=\"rgba(91,141,239,0.07)\" stroke=\"var(--lc-border)\" stroke-width=\"1\"/><text x=\"20\" y=\"147\" fill=\"var(--lc-text)\" font-size=\"13\">max(nums) = 5，min(nums) = 1</text><text x=\"20\" y=\"167\" fill=\"var(--lc-text)\" font-size=\"13\">best = 5 - 1 = 4 → 回傳 4 × 3 = </text><text x=\"280\" y=\"167\" fill=\"var(--lc-success)\" font-size=\"13\" font-weight=\"700\">12 ✓</text></svg><h4 style=\"margin:16px 0 8px 0;color:var(--lc-primary);\">⏱️ 複雜度分析</h4><table style=\"width:100%;border-collapse:collapse;margin:8px 0;\"><tr style=\"background:rgba(91,141,239,0.1);\"><th style=\"padding:8px;border:1px solid var(--lc-border);text-align:left;\">指標</th><th style=\"padding:8px;border:1px solid var(--lc-border);text-align:left;\">複雜度</th><th style=\"padding:8px;border:1px solid var(--lc-border);text-align:left;\">原因</th></tr><tr><td style=\"padding:8px;border:1px solid var(--lc-border);\"><strong>時間</strong></td><td style=\"padding:8px;border:1px solid var(--lc-border);\"><code>O(n)</code></td><td style=\"padding:8px;border:1px solid var(--lc-border);\">線性掃描一次求 max 和 min</td></tr><tr><td style=\"padding:8px;border:1px solid var(--lc-border);\"><strong>空間</strong></td><td style=\"padding:8px;border:1px solid var(--lc-border);\"><code>O(1)</code></td><td style=\"padding:8px;border:1px solid var(--lc-border);\">只用固定幾個變數，無額外資料結構</td></tr></table><div style=\"background:rgba(255,200,0,0.12);padding:14px;border-radius:8px;border-left:4px solid var(--lc-warning);margin:16px 0;\"><strong>💡 Key Insight</strong><br><span style=\"line-height:1.6;\">子陣列的「價值」具有<strong>單調不遞減</strong>性質：延長子陣列只會讓 max 增大或持平、min 減小或持平，因此最大單段價值等於整個陣列的全域 max 減全域 min。選 k 次此最大值即為最優解，無需複雜枚舉。</span></div></div>",
  "related_slugs": ["destroying-asteroids", "minimum-cost-of-buying-candies-with-discount"]
}
